{
  "calibration_snapshot_id": "calibration_2026_05_28",
  "created_at": "2026-05-28T00:00:00Z",
  "created_by": "human",
  "description": "Mock station for bootstrap testing.",
  "devices": [
    {
      "device_id": "smb100a_01",
      "device_type": "smb100a",
      "profile_id": "smb100a_default_fm_500hz",
      "required": true,
      "transport": {
        "host": "192.168.0.20",
        "kind": "tcp_scpi",
        "port": 5025
      }
    },
    {
      "device_id": "oe1022d_01",
      "device_type": "oe1022d",
      "profile_id": "oe1022d_chb_default",
      "required": true,
      "transport": {
        "baud_rate": 115200,
        "kind": "serial",
        "port": "COM3"
      }
    },
    {
      "device_id": "laser_01",
      "device_type": "laser",
      "required": false,
      "transport": {
        "kind": "serial",
        "port": "COM4"
      }
    },
    {
      "device_id": "mag_xyz_01",
      "device_type": "magnet_xyz",
      "profile_id": "mag_xyz_default",
      "required": true,
      "transport": {
        "kind": "serial_group",
        "ports": [
          "COM5",
          "COM6",
          "COM7"
        ]
      }
    }
  ],
  "id": "station_nv_lab_01",
  "kind": "station",
  "name": "NV ODMR Station 01",
  "safety_profile_id": "safety_nv_station_default",
  "schema_version": "0.2.0"
}